[
  {
    "id": "a7411917-ee9a-48ac-b588-6606e03e58c1",
    "source": "Salvage Union Workshop Manual",
    "name": "Comms Module",
    "techLevel": 1,
    "slotsRequired": 1,
    "salvageValue": 1,
    "recommended": true,
    "page": 190,
    "actions": ["Comms Module"],
    "additionalSources": [
      {
        "source": "Salvage Union Starter Set",
        "booklet": "PC",
        "page": 64
      }
    ]
  },
  {
    "id": "f8acedfb-56da-4ca2-8bb8-511d95a23abe",
    "source": "Salvage Union Workshop Manual",
    "name": "Equipment Locker",
    "techLevel": 1,
    "slotsRequired": 1,
    "salvageValue": 1,
    "page": 190,
    "actions": ["Equipment Locker"],
    "additionalSources": [
      {
        "source": "Salvage Union Starter Set",
        "booklet": "PC",
        "page": 65
      }
    ]
  },
  {
    "id": "25ca5163-7ac1-47d3-b36c-377aaf2773fe",
    "source": "Salvage Union Workshop Manual",
    "name": "Eggs Mayhem",
    "techLevel": 1,
    "slotsRequired": 1,
    "salvageValue": 3,
    "page": 190,
    "actions": ["Eggs Mayhem"],
    "additionalSources": [
      {
        "source": "Salvage Union Starter Set",
        "booklet": "PC",
        "page": 64
      }
    ]
  },
  {
    "id": "dde4b6c5-fe3c-4d18-a6c3-15ba7630db96",
    "source": "Salvage Union Workshop Manual",
    "name": "Firewall",
    "techLevel": 1,
    "slotsRequired": 1,
    "salvageValue": 2,
    "page": 191,
    "actions": ["Firewall"],
    "additionalSources": [
      {
        "source": "Salvage Union Starter Set",
        "booklet": "PC",
        "page": 65
      }
    ]
  },
  {
    "id": "ab7c2af1-f474-4cc0-8dc9-3942d6f24d8b",
    "source": "Salvage Union Workshop Manual",
    "name": "Personal Recreation Device",
    "techLevel": 1,
    "slotsRequired": 1,
    "salvageValue": 1,
    "page": 191,
    "actions": ["Personal Recreation Device"],
    "additionalSources": [
      {
        "source": "Salvage Union Starter Set",
        "booklet": "PC",
        "page": 65
      }
    ]
  },
  {
    "id": "92677d7f-3490-48ee-9554-513355c967ce",
    "source": "Salvage Union Workshop Manual",
    "name": "Reactor Flare",
    "techLevel": 1,
    "slotsRequired": 1,
    "salvageValue": 1,
    "page": 191,
    "actions": ["Reactor Flare"],
    "additionalSources": [
      {
        "source": "Salvage Union Starter Set",
        "booklet": "PC",
        "page": 66
      }
    ]
  },
  {
    "id": "a93614fa-1e90-4fed-b806-4f2f4ea77dab",
    "source": "Salvage Union Workshop Manual",
    "name": "Self-Destruct",
    "techLevel": 1,
    "slotsRequired": 1,
    "salvageValue": 1,
    "page": 192,
    "actions": ["Self-Destruct"],
    "additionalSources": [
      {
        "source": "Salvage Union Starter Set",
        "booklet": "PC",
        "page": 66
      }
    ]
  },
  {
    "id": "655c1325-9525-4a7f-a601-e302e5240208",
    "source": "Salvage Union Workshop Manual",
    "name": "Survey Scanner",
    "techLevel": 1,
    "slotsRequired": 1,
    "salvageValue": 3,
    "page": 192,
    "actions": ["Survey Scanner"],
    "additionalSources": [
      {
        "source": "Salvage Union Starter Set",
        "booklet": "PC",
        "page": 67
      }
    ]
  },
  {
    "id": "d54471d7-562a-4f25-8f3d-740ffc520dc3",
    "source": "Salvage Union Workshop Manual",
    "name": "Weapon Link",
    "techLevel": 1,
    "slotsRequired": 1,
    "salvageValue": 3,
    "page": 193,
    "actions": ["Weapon Link"],
    "additionalSources": [
      {
        "source": "Salvage Union Starter Set",
        "booklet": "PC",
        "page": 67
      }
    ]
  },
  {
    "id": "301a86b9-2508-41ed-939f-f416c050dccc",
    "source": "Salvage Union Workshop Manual",
    "name": "Zoom Optics",
    "techLevel": 1,
    "slotsRequired": 1,
    "salvageValue": 2,
    "page": 193,
    "actions": ["Zoom Optics"],
    "additionalSources": [
      {
        "source": "Salvage Union Starter Set",
        "booklet": "PC",
        "page": 67
      }
    ]
  },
  {
    "id": "bca31633-15d8-4441-9d84-1857546b50cb",
    "source": "Salvage Union Workshop Manual",
    "name": "Barometric Sensor",
    "techLevel": 2,
    "slotsRequired": 1,
    "salvageValue": 1,
    "page": 193,
    "actions": ["Barometric Sensor"],
    "additionalSources": [
      {
        "source": "Salvage Union Starter Set",
        "booklet": "PC",
        "page": 68
      }
    ]
  },
  {
    "id": "5360e2ed-f25f-4d7a-9ec0-7b0bdc0af758",
    "source": "Salvage Union Workshop Manual",
    "name": "Damage Assessor",
    "techLevel": 2,
    "slotsRequired": 1,
    "salvageValue": 1,
    "page": 193,
    "actions": ["Damage Assessor"],
    "additionalSources": [
      {
        "source": "Salvage Union Starter Set",
        "booklet": "PC",
        "page": 68
      }
    ]
  },
  {
    "id": "ffa5abd0-c7b4-4adb-8411-132040d385a5",
    "source": "Salvage Union Workshop Manual",
    "name": "Energy Cell",
    "techLevel": 2,
    "slotsRequired": 1,
    "salvageValue": 2,
    "page": 194,
    "actions": ["Energy Cell"],
    "additionalSources": [
      {
        "source": "Salvage Union Starter Set",
        "booklet": "PC",
        "page": 69
      }
    ]
  },
  {
    "id": "10ccfd99-5580-4a94-a9b7-50c24fd7faf3",
    "source": "Salvage Union Workshop Manual",
    "name": "Deep Survey Scanner",
    "techLevel": 2,
    "slotsRequired": 1,
    "salvageValue": 2,
    "page": 194,
    "actions": ["Deep Survey Scanner"],
    "additionalSources": [
      {
        "source": "Salvage Union Starter Set",
        "booklet": "PC",
        "page": 69
      }
    ]
  },
  {
    "id": "746b6003-1100-4c22-ab2a-5593fafe3e41",
    "source": "Salvage Union Workshop Manual",
    "name": "Evasion Protocols",
    "techLevel": 2,
    "slotsRequired": 1,
    "salvageValue": 1,
    "page": 194,
    "actions": ["Evasion Protocols"],
    "additionalSources": [
      {
        "source": "Salvage Union Starter Set",
        "booklet": "PC",
        "page": 69
      }
    ]
  },
  {
    "id": "3d096dd7-7437-4af1-a8ab-28cf9886cae4",
    "source": "Salvage Union Workshop Manual",
    "name": "Hull Magnetiser",
    "techLevel": 2,
    "slotsRequired": 1,
    "salvageValue": 2,
    "contributions": [{"stat": "cargoCapacity", "target": "self", "amount": {"fromStat": "systemSlots"}, "duration": "activated", "note": "\"increases your Mech's Cargo Capacity by its System Slot Value\" — manual expiry"}],
    "page": 194,
    "actions": ["Hull Magnetiser"],
    "additionalSources": [
      {
        "source": "Salvage Union Starter Set",
        "booklet": "PC",
        "page": 69
      }
    ]
  },
  {
    "id": "91256ee6-a6d8-4bee-a457-1f7b87b177a4",
    "source": "Salvage Union Workshop Manual",
    "name": "IR Night Vision Optics",
    "techLevel": 2,
    "slotsRequired": 1,
    "salvageValue": 2,
    "page": 195,
    "actions": ["IR Night Vision Optics"],
    "additionalSources": [
      {
        "source": "Salvage Union Starter Set",
        "booklet": "PC",
        "page": 70
      }
    ]
  },
  {
    "id": "893a303c-7b53-4956-945e-ee8619859ca2",
    "source": "Salvage Union Workshop Manual",
    "name": "Metal Detector",
    "techLevel": 2,
    "slotsRequired": 1,
    "salvageValue": 2,
    "actions": ["Auto-Scan", "Active Scan", "Metal Detector"],
    "page": 195,
    "additionalSources": [
      {
        "source": "Salvage Union Starter Set",
        "booklet": "PC",
        "page": 70
      }
    ]
  },
  {
    "id": "c8c03a99-b0d4-4071-b92d-0fa3cb9de6e0",
    "source": "Salvage Union Workshop Manual",
    "name": "M315 Motion Scanner",
    "techLevel": 2,
    "slotsRequired": 1,
    "salvageValue": 2,
    "page": 195,
    "actions": ["M315 Motion Scanner"],
    "additionalSources": [
      {
        "source": "Salvage Union Starter Set",
        "booklet": "PC",
        "page": 70
      }
    ]
  },
  {
    "id": "c753cba0-29f8-4690-82f7-ca146251682c",
    "source": "Salvage Union Workshop Manual",
    "name": "Navigation Module",
    "techLevel": 2,
    "slotsRequired": 1,
    "salvageValue": 2,
    "page": 196,
    "actions": ["Navigation Module"],
    "additionalSources": [
      {
        "source": "Salvage Union Starter Set",
        "booklet": "PC",
        "page": 71
      }
    ]
  },
  {
    "id": "09409fcc-9463-465b-91e5-5580bc1ce7bd",
    "source": "Salvage Union Workshop Manual",
    "name": "Pinpoint Targeter",
    "techLevel": 2,
    "slotsRequired": 1,
    "salvageValue": 3,
    "page": 196,
    "actions": ["Pinpoint Targeter"],
    "additionalSources": [
      {
        "source": "Salvage Union Starter Set",
        "booklet": "PC",
        "page": 71
      }
    ]
  },
  {
    "id": "d0eeed2b-690e-486e-936a-ec2baac2a48e",
    "source": "Salvage Union Workshop Manual",
    "name": "Reactor Overload",
    "techLevel": 2,
    "slotsRequired": 1,
    "salvageValue": 3,
    "page": 196,
    "actions": ["Reactor Overload"],
    "additionalSources": [
      {
        "source": "Salvage Union Starter Set",
        "booklet": "PC",
        "page": 72
      }
    ]
  },
  {
    "id": "f1c9860f-949c-44ee-9d77-baf6016b38fb",
    "source": "Salvage Union Workshop Manual",
    "name": "Video Projection Array",
    "techLevel": 2,
    "slotsRequired": 1,
    "salvageValue": 1,
    "page": 196,
    "actions": ["Video Projection Array"],
    "additionalSources": [
      {
        "source": "Salvage Union Starter Set",
        "booklet": "PC",
        "page": 71
      }
    ]
  },
  {
    "id": "df8846de-8b69-4199-a20e-09bac424e6a1",
    "source": "Salvage Union Workshop Manual",
    "name": "Sleeping Beauty",
    "techLevel": 2,
    "slotsRequired": 1,
    "salvageValue": 2,
    "page": 197,
    "actions": ["Sleeping Beauty"],
    "additionalSources": [
      {
        "source": "Salvage Union Starter Set",
        "booklet": "PC",
        "page": 73
      }
    ]
  },
  {
    "id": "2cf1bba0-3614-4559-adfe-f353ff04bbd0",
    "source": "Salvage Union Workshop Manual",
    "name": "Reactor Safety Protocols",
    "techLevel": 2,